October Capital,https://www.crunchbase.com/organization/october-capital,"Kansas City, Missouri, United States",,,Midwestern US,,,,,,,,Active,October Capital is a family investment firm that finances early and growth stage ventures.,1999-01-01,year,,,,,,http://www.octobercapital.com,info@octobercapital.com,913-362-1114,,Family Investment Office,Early Stage Venture,4,4,,1,1,1,,,,"24,376",0.4,0.9,0,,46.2,,,,,,,,,,,7,,,,,,,,,,
Think Big Partners,https://www.crunchbase.com/organization/think-big-partners,"Kansas City, Missouri, United States",,,Midwestern US,,"Think Big Partners is an early-stage startup accelerator and mentorship-based collaborative network located in Kansas City, Missouri.  Think Big Partners has successfully launched or grown over 150 successful companies with its creation of coworking spaces (Think Big Coworking), entrepreneurial conferences (Think Big Kansas City and iKC), essential services, startup resources and funding (Think Big Ventures).",8,http://twitter.com/thinkbigKC,http://www.linkedin.com/company/1218185,http://www.facebook.com/ThinkBigPartners,,Active,"Think Big Partners is an early-stage startup accelerator and mentorship-based collaborative network based in Kansas City, Missouri.",2010-01-01,year,,,,,,http://www.thinkbigpartners.com,,,,Co-Working Space,"Early Stage Venture, Seed",2,4,,,1,1,,,,"24,824",-0.3,0.4,-0.1,773,"1,216.74",-43.11%,49,-77.62%,1.58,29.95%,65.24%,16.6%,"13,899,581","1,692,028",13.86%,40,,,10,,,,,61020,USD,61020
Tappan Hill Ventures,https://www.crunchbase.com/organization/tappan-hill-ventures,"Ann Arbor, Michigan, United States",,,"Great Lakes, Midwestern US",,,,,,,,Active,"Tappan Hill Ventures is a venture capital firm specializing in seed stage, early growth and rare later stage investments.",2014-01-01,year,,,,,,http://www.tappanhillventures.com,contact@tappanhillventures.com,734 355 7399,,Venture Capital,,4,4,,,,,,,,"24,846",1.3,1.2,3.1,276,165.2,-2.41%,71,"6,431.49%",2.55,92.42%,0%,-63.46%,"19,809,587","-2,072,753",-9.47%,6,,,6,,,,,,,
NorthPort Investments,https://www.crunchbase.com/organization/northport-investments,"Northfield, Minnesota, United States",,,"Great Lakes, Midwestern US",,"Northport Investments was founded in 1996 by David T. Shelby and is headquartered in Northfield, IL, a suburb of Chicago. We have partners located in Chicago, Indianapolis, Denver, Ft. Collins (CO) and the Boston area.",1,,,,,Active,NorthPort Investments is a Minnesota-based private equity firm that offers later stage investment services.,1996-01-01,year,,,,,,http://www.northportinvestments.com,contact@northportinvestments.com,,,Private Equity Firm,"Late Stage Venture, Private Equity",4,4,,,4,4,,,,"26,927",0,2.6,4.8,,,,,,,,,,,,,4,,,,,,,,,,
Technology Venture Partners US,https://www.crunchbase.com/organization/technology-venture-partners-us,"Minneapolis, Minnesota, United States",,,"Greater Minneapolis-Saint Paul Area, Great Lakes, Midwestern US",,"Technology Venture Partners, LLC (TVP) is a private investment firm focused on growth-oriented technology companies across all stages. The firm primarily manages an $85 million venture capital fund and is involved in other private and public investment activities. Their investment orientation and portfolio target technologies and market opportunities that have the potential for significant growth. Their financial commitment and expertise, industry knowledge and strategic insight provide entrepreneurs and company leaders with the resources needed to develop and build successful companies.",,,,,,Active,"Technology Venture Partners, LLC (TVP) is a private investment firm focused on growth-oriented technology companies across all stages.",,,,,,,,http://www.tvp.com,email@tvp.com,,,Venture Capital,Late Stage Venture,2,4,,1,1,1,,,,"27,517",0.9,-0.1,4.8,702,"1,396.07",-72.44%,1,-80.05%,1.07,-64.01%,20.29%,12.52%,"18,326,763","11,155,746",155.57%,8,,,,,,,,32216,USD,32216
Gazelle Tech Ventures,https://www.crunchbase.com/organization/gazelle-tech-ventures,"Carmel, Indiana, United States",,,"Great Lakes, Midwestern US",,"Our objective at Gazelle TechVentures is to be the hub of venture capital activity in Indiana and one of the most respected, leading funds in the Midwest. The formation of the Gazelle Fund is the result of literally thousands of conversations over the past several years between entrepreneurs, government officials, University administration and faculty, private investors and business leaders about the need for more early stage and venture capital in Indiana. While the universities, local technology businesses and entrepreneurs continue to create attractive investing opportunities, Indiana lags in investing in those opportunities. The existence of a wide funding gap presents a tremendous investment opportunity for investors in the Gazelle Fund. Gazelle TechVentures, Inc. was created when a number of senior Indiana business leaders assembled to address the funding gap as a business opportunity. This group set out to create an aggressive and well-capitalized venture capital company based on the best national models of success. As members of the General Partner's Executive Committee they have committed their time and their capital to the objective of making Gazelle ""The hub of venture capital activity in Indiana and one of the most respected, leading funds in the Midwest.""",,,,,,Active,Tech VC in Indiana,1999-01-01,year,,,,,,http://www.gazellevc.com/index.htm,,,,Venture Capital,Early Stage Venture,2,4,,,2,2,,,,"27,899",-0.2,-0.1,-0.1,88,14.7,,15,,2,,,,"30,283,606",,,9,,,,,,,,,,
Conquer Accelerator,https://www.crunchbase.com/organization/conquer-accelerator,"East Lansing, Michigan, United States",,,"Great Lakes, Midwestern US",,"As a summer accelerator with a strong bench of experienced entrepreneurs, business leaders, and motivated investors, Conquer provides select teams with an intensive ten weeks tailored programming and mentorship. Our startups focus on goal-driven benchmarks, honing their ventures and bringing their solutions to the market. Conquer Accelerator is a collaborative effort at Michigan State University made possible through generous partnerships with the MSU Foundation, its subsidiary, Red Cedar Ventures, and Michigan State University Federal Credit Union. Any qualifying business may apply to program—an existing affiliation with Michigan State University is required. For those companies who are part of Michigan State University's entrepreneurial ecosystem, Conquer Accelerator fills a crucial gap in their development cycle. Conquer's selected teams receive an investment of $20k and work through an intensive ten-week season. In addition to capital investment, Conquer Accelerator teams receive one-on-one mentorship and support, a creative co-working space, and strategic resources. Startup applicants should reflect the following attributes: • products or services that solve problems for specific target customers • capital-efficient business, operational at less than $1M in external funding • scalable distribution or proven ability to scale sales • simple revenue model: transactions, subscriptions, affiliates • functional prototype or prior product success • measurable traction (engaged users, revenue, attractive unit economics) • three (or more) members in a cross-functional team • ability to be located in East Lansing, Michigan for the duration of the program Find our previous cohort teams, learn how to apply, and follow the journey: conqueraccelerator.com.",5,https://twitter.com/MSU_Conquer,https://www.linkedin.com/company/conquer-accelerator,https://www.facebook.com/ConquerAccelerator/,,Active,"Conquer gives startups a head start: $20k in investment capital, ten weeks of hands-on mentoring, & access to a network of business leaders.",2016-05-01,day,,,,,,http://www.conqueraccelerator.com/,jaques@msu.edu,(517) 256-9285,,Accelerator,"Early Stage Venture, Seed",4,4,,1,1,1,On-Site,2020-04-17,10,"28,542",-0.3,-1,4.2,183,156.63,-37.73%,126,322.24%,2,0.27%,0%,-50.27%,"24,378,721","4,534,763",22.85%,6,,,,,,,,,,
Arbor Partners,https://www.crunchbase.com/organization/arbor-partners,"Ann Arbor, Michigan, United States",,,"Great Lakes, Midwestern US",,,,,,,,Active,Arbor Partners is a venture capital firm.,1996-01-01,year,,,,,,http://www.arborpartners.com,info@arborpartners.com,,,Venture Capital,Venture,3,4,,,,,,,,"29,179",-0.2,-0.1,2.4,478,135.97,,209,,8.04,,,,"11,668,451",,,5,,,,,,,,98550,USD,98550
Bir Ventures,https://www.crunchbase.com/organization/bir-ventures,"Bloomington, Minnesota, United States",,,"Greater Minneapolis-Saint Paul Area, Great Lakes, Midwestern US",,"Bir Ventures develops knowledge-based products that solve real world problems and launches them into the market. Our vision is to create a world where people can collaborate with each other regardless of physical distance between them, and use our collective intelligence to solve complex problems. Whether you are an individual with a great idea, a business with a fresh concept, or a community with an innovative idea of solving a real world problem, we partner with you in reducing your risk of investment in the new product and increasing the probability of success.",,http://twitter.com/birventures,http://www.linkedin.com/company/2852370,http://www.facebook.com/BirVentures,,Active,Bir Ventures develops knowledge-based products that solve real world problems and launches them into the market.,2012-08-01,day,,,,,,http://www.birventures.com/,info@birventures.com,(612)666-9247,,Incubator,"Non Equity Assistance, Seed",4,4,,,,,,,,"30,779",1.1,0.7,-0.1,42,509.96,-41.94%,1,-99.87%,2,-66.75%,,,"32,842,966","5,685,169",20.93%,26,,,,,,,,58012,USD,58012
Cedar Point Capital,https://www.crunchbase.com/organization/cedar-point-capital,"Saint Louis Park, Minnesota, United States",,,"Greater Minneapolis-Saint Paul Area, Great Lakes, Midwestern US",,,6,,,,,Active,"Cedar Point Capital is a boutique investment bank based in Minneapolis, Minnesota.",,,,,,,,,,,,Venture Capital,"Debt, Late Stage Venture",4,4,,1,,,,,,"32,947",-0.3,-0.2,0,,,,,,,,,,,,,,,,,,,,,,,
DTE Energy Ventures,https://www.crunchbase.com/organization/dte-energy-ventures,"Ann Arbor, Michigan, United States",,,"Great Lakes, Midwestern US",,,9,,,,,Active,"DTE Energy Ventures, a venture capital firm, invests in energy technology companies helping them develop products and nurture businesses.",,,,,,,,http://www.dteenergyventures.com,,,,Venture Capital,Late Stage Venture,2,4,,1,1,1,,,,"35,290",-0.2,0,-0.3,,,,,,,,,,,,,,,,,,,,,,,
Securitas Capital,https://www.crunchbase.com/organization/securitas-capital,"Ann Arbor, Michigan, United States",,,"Great Lakes, Midwestern US",,,,https://www.twitter.com/ijaraloans,,https://www.facebook.com/ijaraloans,,Closed,Securitas Capital manages two investment funds with aggregate capital commitments.,2005-01-01,year,,,,none,,http://www.securitascapital.com/,,,,Venture Capital,"Early Stage Venture, Venture",4,4,,3,1,1,,,,"35,406",-0.3,-0.5,3.7,,,,,,,,,,,,,9,,,,,,,,,,
The Rahn Group,https://www.crunchbase.com/organization/the-rahn-group,"Minneapolis, Minnesota, United States",,,"Greater Minneapolis-Saint Paul Area, Great Lakes, Midwestern US",,"The Rahn Group, LLC is a privately held investment firm. The Rahn Group has invested across many asset classes including agriculture, alternative energy, commodities, public and private equity, real estate and venture capital.",,,,,,Closed,"The Rahn Group, LLC is a privately held investment firm.",1997-01-01,year,,,2014-01-05,day,,http://www.rahngroup.com,,,,Private Equity Firm,Private Equity,3,4,,,2,2,,,,"36,398",-0.2,0,0.4,,,,,,,,,,,,,6,,,,,,,,,,
Canopy Group,https://www.crunchbase.com/organization/canopy-group,"Le Sueur, Minnesota, United States",,,"Greater Minneapolis-Saint Paul Area, Great Lakes, Midwestern US",,,1,https://www.twitter.com/thecanopygroup,,https://www.facebook.com/thecanopygroup,,Active,Canopy Group is a company that provides insurance services.,,,,,,,,http://www.thecanopygroup.com,,(800) 967-3389,,Venture Capital,"Early Stage Venture, Late Stage Venture",4,4,,2,2,2,,,,"36,730",2.8,1.4,0.6,"4,988","2,643.52","6,530.96%",35,-55.69%,3.13,22.44%,3.06%,-45.13%,"4,419,706","-25,937,120",-85.44%,12,,,,,,,,41441,USD,41441
Tennant Capital Partners,https://www.crunchbase.com/organization/tennant-capital-partners,"Saint Louis, Missouri, United States",,,Midwestern US,,"Tennant Capital Partners is a venture capital firm focused on insurance and insurance services. Tennant Capital Partners invests in small to medium sized insurance organizations with a strategy of specialization. Targets include distribution, underwriting and service organizations. Distribution companies include specialty agents and brokers, program and underwriting managers (wholesale & retail), and surplus lines insurance brokers.",1,,,,,Active,Tennant Capital Partners is a venture capital firm focused on insurance and insurance services.,2006-01-01,year,,,,,,http://tennantcapital.com,,860-519-1301,,Venture Capital,Early Stage Venture,2,4,,1,,,,,,"41,318",-0.5,-0.4,0.8,,,,,,,,,,,,,13,,,,,,,,,,
Mayhem Development,https://www.crunchbase.com/organization/mayhem-development,"Springfield, Missouri, United States",,,Midwestern US,,,,,,,,Active,To create and invest in ideas that have the potential to disrupt markets and positively impact the lives of others.,2015-01-01,day,,,,,,http://www.mayhemdev.com/,,,,Venture Capital,Early Stage Venture,2,4,,,1,1,,,,"46,162",-0.1,3.4,4.6,149,24.88,,44,,4,,,,"23,244,127",,,9,,,,,,,,,,
GDN Holdings,https://www.crunchbase.com/organization/gdn-holdings,"Minnetonka, Minnesota, United States",,,"Greater Minneapolis-Saint Paul Area, Great Lakes, Midwestern US",,"GDN Holdings, LLC operates as a healthcare management advisory company. The company was founded in 1998 and is based in Minnetonka, Minnesota.",,,,,,Active,"GDN Holdings, LLC operates as a healthcare management advisory company. The company was founded in 1998 and is based in Minnetonka,",1998-01-01,year,,,,,,,,,,Venture Capital,Late Stage Venture,3,4,,1,1,1,,,,"49,522",-0.6,-0.5,-0.5,,,,,,,,,,,,,,,,,,,,,,,
Acartha Group,https://www.crunchbase.com/organization/acartha-group,"St Louis, Missouri, United States",,,Midwestern US,,,1,,,,,Closed,Acartha Group is a private equity firm based in Missouri that finances early stage ventures.,,,,,,none,,http://www.acarthatechpartners.com,,,,Private Equity Firm,Early Stage Venture,3,4,,,2,2,,,,"55,977",3,2.1,0.1,,,,,,,,,,,,,1,,,,,,,,,,
HMA Capital Partners,https://www.crunchbase.com/organization/hma-capital-partners,"Lansing, Michigan, United States",,,"Great Lakes, Midwestern US",,,,,,,,Active,HMA Capital Partners is a Michigan-based capital investment fund that focuses on publicly financed healthcare programs in America.,,,,,,,,,,,,Venture Capital,,3,4,,2,3,3,,,,"63,844",0.3,0,-0.5,,,,,,,,,,,,,,,,,,,,,,,
Cleveland Pacific Equity Ventures,https://www.crunchbase.com/organization/cleveland-pacific-equity-ventures,"Chagrin Falls, Ohio, United States",,,"Great Lakes, Midwestern US",,,,,,,,Active,"Cleveland Pacific Equity Ventures is a financial advisory firm that is based in Chagrin Falls, Ohio.",,,,,,,,,,,,Venture Capital,"Early Stage Venture, Late Stage Venture",4,4,,1,2,2,,,,"67,450",-0.2,0.4,0.2,,,,,,,,,,,,,,,,,,,,,,,
Gateway Associates,https://www.crunchbase.com/organization/gateway-associates,"Minneapolis, Minnesota, United States",,,"Greater Minneapolis-Saint Paul Area, Great Lakes, Midwestern US",,,,,,,,Active,Gateway Associates is a company that provides insurance services.,1917-01-01,year,,,,,,,,(888) 834-7428,,Venture Capital,,3,4,,1,1,1,,,,"69,592",-0.2,1.1,-0.2,,,,,,,,,,,,,11,,,,,,,,,,
Nationwide Mutual Capital,https://www.crunchbase.com/organization/nationwide-mutual-capital,"Columbus, Ohio, United States",,,"Great Lakes, Midwestern US",,"Nationwide Mutual Capital takes a targeted, industry-focused approach to investing. We invest in the following areas: enterprise software, business process outsourcing, insurance, financial services, and health and productivity. Our focus and domain expertise help us quickly understand your business to refine and execute strategies, enabling our portfolio companies to reach the highest levels of performance.",,,,,,Active,"Nationwide Mutual Capital, a private equity firm based in Columbus, invests in enterprise software, BPO, insurance, and financial services.",,,,,,,,,NMCinfo@nationwide.com,,,Private Equity Firm,"Late Stage Venture, Private Equity",4,4,,1,2,2,,,,"73,141",-0.5,-0.4,-1.1,,,,,,,,,,,,,,,,,,,,,,,
ZyQuest Ventures,https://www.crunchbase.com/organization/zyquest-ventures-wisconsin,"De Pere, Wisconsin, United States",,,"Great Lakes, Midwestern US",,ZyQuest Ventures is the investment arm of ZyQuest Inc. Technology and Development. Its headquarters is in De Pere in Wisconsin.,1,,,,,Active,ZyQuest Ventures is the investment arm of ZyQuest Inc. Technology and Development.,,,,,,,,,,,,Venture Capital,Early Stage Venture,4,4,,1,,,,,,"76,850",0,-0.7,-1,,,,,,,,,,,,,,,,,,,,,,,
BioMotiv,https://www.crunchbase.com/organization/biomotiv,"Cleveland, Ohio, United States",,,"Great Lakes, Midwestern US",,"BioMotiv is the mission-aligned development company of The Harrington Project for Discovery and Development. The Harrington Project, unveiled in February by University Hospitals (UH), is a first-of-its-kind $250 million initiative that promises to revolutionize how new breakthrough drugs are advanced to market. By aligning the upstream efforts of the recently created UH Case Medical Center’s Harrington Discovery Institute with the downstream development efforts of BioMotiv, The Harrington Project seeks to accelerate the therapeutic innovation process for the benefit of patients globally.",18,,http://www.linkedin.com/company/3217531,,,Active,BioMotiv is a therapeutic accelerator developing a portfolio of novel medicines.,2012-01-01,year,,,,,,http://www.biomotiv.com,communications@biomotiv.com,216-455-3200,,Accelerator,,3,3,,2,,,,,,"2,277",0.8,-0.7,-0.1,"1,102","1,634.47",-43.19%,12,-94.71%,4.84,11.75%,30.77%,10.42%,"8,809,682","2,080,601",30.92%,5,,,14,,,,,66397,USD,66397
Polaris Industries,https://www.crunchbase.com/organization/polaris-industries-inc,"Medina, Ohio, United States",,,"Great Lakes, Midwestern US",,"Polaris is a strong believer that the key to its success is in the ethics and values of its employees. The Polaris values were defined by its employees, and to prove that this is not just lip service, the Polaris Performance Management Program evaluates employee performance not only on delivered results but also on how well they represent company values",170,https://www.twitter.com/polarisorv,https://www.linkedin.com/company/polaris-industries/,https://www.facebook.com/polarisrzr,,Active,"Polaris Industries is an american manufacturer of snowmobiles, atv, and neighborhood electric vehicles.",1954-01-01,year,1987-09-25,day,,,,http://www.polaris.com/en-us,experience.center@polarisind.com,1(800)765-2747,,Venture Capital,"Early Stage Venture, Late Stage Venture",2,3,,3,1,1,,,,"4,523",-0.5,-0.3,-0.3,"1,725,699","1,627,339.79",10.51%,185,18.17%,3.6,7.15%,47.45%,-2.22%,"35,950","-4,090",-10.21%,98,11,"13,895",57,452,612,Vehicles In General,Vehicles,,,
Digital Sandbox KC,https://www.crunchbase.com/organization/digital-sandbox-kc,"Kansas City, Missouri, United States",,,Midwestern US,,"The mission of Digital Sandbox KC is to provide proof-of-concept resources to support early-stage commercialization processes including access to technology, business and market experts and funding for early stage market validation, prototyping and beta testing services.",4,http://twitter.com/TheSandboxKC,,http://www.facebook.com/kcsourcelink,$1M to $10M,Active,Early-stage commercialization support,2003-12-05,day,,,,,,http://www.digitalsandboxkc.com,info@kcsourcelink.com,(816) 235-6500,,Accelerator,,3,3,,,,,,,,"5,086",0,-0.1,1,771,577.34,76.18%,4,-84.53%,1.48,-29.81%,76.18%,12.96%,"14,097,844","-2,387,801",-14.48%,28,,,,,,,,,,
Thompson Street Capital Partners,https://www.crunchbase.com/organization/thompson-street-capital-partners,"St Louis, Missouri, United States",,,Midwestern US,,"Thompson Street Capital Partners is a private equity firm investing in service, manufacturing and distribution businesses. The firm partners with management in recapitalizations, management buyouts, corporate divestitures, family businesses in transition and take-private transactions. Thompson Street Capital Partners is located in St. Louis, Missouri and was founded in 2000.",24,,,,,Active,"Thompson Street Capital Partners is a private equity firm investing in service, manufacturing and distribution businesses.",2000-01-01,year,,,,,,http://www.tscp.com,info@tscp.com,(314) 727-2112,,Private Equity Firm,Debt,3,3,,1,,,,,,"10,033",0.3,0.5,1,"2,133","4,541.85",-69.64%,10,-61.29%,1.65,-14.77%,38.44%,-1.38%,"8,529,626","4,802,637",128.86%,16,,,,,,,,3796740,USD,3796740
Rizvi Traverse Management,https://www.crunchbase.com/organization/rizvi-traverse-management,"Birmingham, Michigan, United States",,,"Greater Detroit Area, Great Lakes, Midwestern US",,"Rizvi Traverse Management believes in a value-oriented, opportunistic investment strategy that combines capital with management expertise. Rizvi Traverse Management seeks to actively create value at its portfolio companies by providing capital, management resources, strategic direction and merger and acquisition advice.",74,,,,,Active,"Rizvi Traverse Management provides capital, management resources, strategic direction, and merger and acquisition advices to businesses.",,,,,,,,http://www.rizvitraverse.com,submissions@rizvitraverse.com,(212) 333-3811,,Venture Capital,Late Stage Venture,3,3,,2,1,1,,,,"11,044",-0.1,0,-0.1,"4,680","1,444.67","1,104.72%",0,-100%,1.01,-60.1%,27.07%,-2.07%,"7,156,574","-9,540,956",-57.14%,25,,,,,,,,3061577,USD,3061577
Victory Capital,https://www.crunchbase.com/organization/victorycapital,"Brooklyn, Ohio, United States",,,"Great Lakes, Midwestern US",,"Victory Capital is a multi-boutique asset manager, Victory Capital connects the right talent with the right resources in the right environment. Our investment professionals are empowered to be their best. Unique talents are amplified. And our energies are focused on what really matters—helping our clients meet their goals.",8,,,,,Active,"Victory Capital Management is a multi-boutique asset manager with nine investment franchises, each with an independent approach.",1993-01-01,year,2018-02-07,day,,,,http://www.vcm.com/,ddy@vcm.com,773-807-8800,,Venture Capital,,3,3,,,,,,,,"12,581",0.8,1.3,0,"25,002","20,108.2",87.66%,84,-62.63%,2.27,-3.64%,45.93%,8.94%,"1,346,082","-642,435",-32.31%,26,,,9,,,,,18852158,USD,18852158
Winslow Capital,https://www.crunchbase.com/organization/winslow-capital,"Minneapolis, Minnesota, United States",,,"Greater Minneapolis-Saint Paul Area, Great Lakes, Midwestern US",,"Winslow Capital is a premier growth equity investment firm grounded in fundamental investing. It seeks growth opportunities in public and private markets globally. Its adherence to a disciplined investment approach is the hallmark of the company's success. Winslow employs a rigorous, proven methodology rooted in robust primary research borne of deep industry relationships. Its tenured team of active equity managers is attuned to market dynamics.",,,https://www.linkedin.com/company/winslow-capital/,,,Active,Winslow Capital is a premier growth equity investment firm grounded in fundamental investing.,1992-01-01,year,,,,,,http://winslowcapital.com,clientservice@winscap.com,612.376.9100,,"Private Equity Firm, Venture Capital",Early Stage Venture,3,3,,,,,,,,"15,084",1.3,2.6,1.7,278,386.72,-30.79%,540,183.13%,6.86,1.85%,54.92%,33.9%,"15,859,658","2,867,371",22.07%,25,,,,,,,,,,
Blackford Capital,https://www.crunchbase.com/organization/blackford-capital,"Grand Rapids, Michigan, United States",,,"Great Lakes, Midwestern US",,"Founded in 2000, Blackford Capital is a private equity firm that acquires, manages and builds middle-market manufacturing, distribution and service companies. The firm combines detailed due diligence and operational experience with the seasoned M&A expertise of a traditional financial buyer. Blackford Capital currently has portfolio companies based in six states with combined revenues of approximately $200 million. Blackford Capital maintains offices in Grand Rapids, Mich. (headquarters) and San Francisco, Calif.  Martin Stein is Founder and Managing Director of Blackford Capital. With more than a decade of private equity experience, Martin leads the firm's acquisition sourcing activities and serves on the boards of five of the firm’s portfolio companies. Additionally, he is Chairman of the Board of Amtech Corporation and Staging Concepts and has been involved in approximately 20 acquisitions, investments and exits.",17,https://www.twitter.com/blackfordpe,https://www.linkedin.com/company/blackford-capital-llc,https://www.facebook.com/blackford-capital-llc-160987244084876,,Active,Blackford Capital is a private equity firm.,2000-01-01,year,,,,,,http://www.blackfordcapital.com,,(616) 233-3161,,Private Equity Firm,Private Equity,3,3,,2,,,,,,"17,860",1.3,1.8,1.5,"2,090","1,884.04",160.5%,103,96.74%,2.36,1.8%,15.17%,-31.38%,"7,592,457","-4,404,710",-36.71%,9,,,15,,,,,7253824,USD,7253824
