Mayo Clinic Ventures,https://www.crunchbase.com/organization/mayo-clinic-ventures,"Rochester, Minnesota, United States",,,"Great Lakes, Midwestern US",,"Mayo Clinic Ventures is dedicated to quickly bringing answers to the people who need them most: the patients living with diseases and conditions that threaten to limit or even end their lives. Our team works closely with Mayo physicians and scientists to mine inventions, ideas and discoveries that will truly transform health care. Their dedicated efforts bring significant financial support to Mayo's patient care, education and research efforts.",4,http://twitter.com/MayoInvents,,https://www.facebook.com/mayoclinic,,Active,Mayo Clinic is for the benefit of patients worldwide while generating revenue to support clinical practic.,,,,,,,,http://ventures.mayoclinic.org/,mayoclinicventures@mayo.edu,,,Venture Capital,"Early Stage Venture, Late Stage Venture",9,14,,3,3,3,,,,"14,345",-0.2,-0.1,-0.1,"2,025","2,513.97",31.23%,352,306.5%,4.08,109.95%,21.06%,-32.18%,,,,13,,,,,,,,,,
4G Ventures,https://www.crunchbase.com/organization/4g-ventures,"Carmel, Indiana, United States",,,"Great Lakes, Midwestern US",,"4G Ventures is a venture capital firm based in Indianapolis, Indiana and is managed by Bill Godfrey.",,,,,,Active,4G Ventures is as Indianapolis-based venture firm focused on seed investments.,2012-01-01,year,,,,,,,,,,"Micro VC, Venture Capital",Early Stage Venture,6,14,,6,1,1,,,,"23,519",-0.5,-1.1,2.6,,,,,,,,,,,,,,,,,,,,,,,
Crystal Internet Venture Funds,https://www.crunchbase.com/organization/crystal-internet-venture-funds,"Cleveland, Ohio, United States",,,"Great Lakes, Midwestern US",,"Crystal Ventures has grown into a family of funds with international offices in North America and Asia that facilitate the pervasive growth and development of worldwide innovation - with special concentration on North America and Asia. They see technological innovation as a global event, but with strong localized flavor imperative to its maturation. Crystal partners with companies that support trans-Pacific synergetic operations with proven technology and products, market potential, exemplary management teams, and unique resources particular to Silicon Valley, Taiwan, Singapore, and mainland China.",1,,,https://www.facebook.com/854500264639042,,Active,Crystal Internet Venture Funds is a venture investment firm.,1997-01-01,year,,,,,,http://www.crystalventure.com,crystal@crystalventures.com,,,Micro VC,"Early Stage Venture, Late Stage Venture",11,14,,3,7,7,,,,"60,800",-0.1,-0.4,-0.7,,,,,,,,,,,,,2,,,,,,,,,,
BioCrossroads,https://www.crunchbase.com/organization/biocrossroads,"Indianapolis, Indiana, United States",,,"Great Lakes, Midwestern US",,,18,http://twitter.com/BioCrossroads,http://www.linkedin.com/company/biocrossroads,,,Active,BioCrossroads is a venture capital firm specializing in life sciences companies based in Indiana.,,,,,,,,http://www.biocrossroads.com,,,,Venture Capital,"Early Stage Venture, Seed",12,13,,2,,,,,,"3,221",-0.3,-0.5,3.1,,800.66,-100%,,,,,,,,,,31,,,,,,,,,,
Northwestern Mutual Future Ventures,https://www.crunchbase.com/organization/northwestern-mutual-future-ventures,"Milwaukee, Wisconsin, United States",,,"Great Lakes, Midwestern US",,"Northwestern Mutual Future Ventures' goal is to help you achieve yours so that together we can create a better financial future for more people. They're different than most corporate venture capital partners: Northwestern Mutual has a 160-year-old track record of industry-leading financial strength, client-centricity and an entrepreneurial culture, which has not only enabled but driven us to always innovate for our clients. Plus, we know what it’s like to be a start-up because we have successful entrepreneurs on our team. In 2015, we combined forces with LearnVest through an acquisition that began as a strategic investing partnership.",17,,,,,Active,Life insurance provider Northwestern Mutual's investment arm.,2017-01-01,year,,,,,,http://nmfutureventures.com/,,,,Corporate Venture Capital,"Early Stage Venture, Late Stage Venture",9,13,,1,,,,,,"5,590",-0.3,4.4,-2,,,,,,,,,,,,,1,,,,,,,,,,
Kauffman Foundation,https://www.crunchbase.com/organization/kauffman-foundation,"Kansas City, Missouri, United States",,,Midwestern US,,"The Ewing Marion Kauffman Foundation was established in the mid-1960s by the late entrepreneur and philanthropist Ewing Marion Kauffman. Based in Kansas City, Missouri, the Kauffman Foundation is among the largest foundations in the United States with an asset base of approximately $2 billion. Their vision is to foster ""a society of economically independent individuals who are engaged citizens, contributing to the improvement of their communities."" In service of this vision, they focus grant making and operations on two areas—education and entrepreneurship—which founder Ewing Kauffman saw as two ends of a continuum.",997,http://twitter.com/kauffmanfdn,http://www.linkedin.com/company/kauffman-foundation,http://www.facebook.com/kauffmanfdn,,Active,Kaufman Foundation focuses on grant making and operations in the fields of education and entrepreneurship.,1960-01-01,year,,,,,,http://kauffman.org,info@kauffman.org,(181) 693-2100,,Incubator,"Early Stage Venture, Grant",12,13,,7,3,3,,,,"12,470",0.2,0,-0.1,"61,363","77,293.92",2.38%,120,-11.11%,2.26,-19.63%,52.81%,0.14%,"689,797","64,948",10.39%,79,4,"1,644",31,,,,,3652,USD,3652
IncWell,https://www.crunchbase.com/organization/incwell,"Birmingham, Michigan, United States",,,"Greater Detroit Area, Great Lakes, Midwestern US",,"We're a private venture capital firm that offers a wealth of business experience to startup and seed stage companies.  We have a mission to grow great ideas into great businesses by providing funding opportunities and strategic business support to the entrepreneurs and teams we believe in. IncWell LP offers seed stage investments to startups in the clean energy technology, medical technology, healthcare advances, transportation technology, and/or information/apps/software technology sectors.  Our investments range in size from $100K- $250K.  In addition to investments, we also provide startup consulting in the form of mentorships and introductions to strategic partners. The fund was launched in May of 2013 and founded by Tom LaSorda, former CEO of Chrysler LLC and Fisker Automotive. Other Limited Partners include Roger Penske, owner of the Penske Corporation, Ted Fuller, real estate developer in Birmingham, MI, John Melstrom, partner at Fenner Melstrom & Dooling PLC for 45 years, Wayne Sales, former CEO of Canadian Tire and Stephen Polk, former CEO of R.L. Polk & Co. In addition, there are eight other key Limited Partners.",10,http://twitter.com/incwellvc,http://www.linkedin.com/company/incwell-llc,http://www.facebook.com/theincwell,,Active,IncWell is a private venture capital firm investing on startup and seed-stage companies.,2013-05-01,day,,,,,,http://www.incwell.net,info@theincwell.net,(248) 593-9355,,Venture Capital,"Early Stage Venture, Seed",12,13,,3,1,1,,,,"12,787",0.1,0,2.4,,29.31,-100%,,,,,,,,,,5,,,,,,,,,,
Resonant Venture Partners,https://www.crunchbase.com/organization/resonant-venture-partners,"Ann Arbor, Michigan, United States",,,"Great Lakes, Midwestern US",,"Resonant Venture Partners is an emerging venture capital firm based in Ann Arbor, Michigan. Founded in 2010, Resonant makes seed stage investments in companies developing cloud infrastructure, software and services. Entrepreneurs in their own right, the managing directors partner with portfolio companies through challenging product, market and operational issues at the earliest phases.",28,http://twitter.com/resonantvc,http://www.linkedin.com/company/941813,,,Active,"Resonant Venture Partners is an emerging venture capital firm based in Ann Arbor, Michigan.",2010-01-01,year,,,,,,http://resonantvc.com,info@resonantvc.com,,,Venture Capital,"Early Stage Venture, Seed",8,13,,,7,7,,,,"16,090",-0.2,0.2,2.8,,94.04,-100%,,,,,,,,,,16,,,5,,,,,,,
Gravity Ventures,https://www.crunchbase.com/organization/gravity-ventures,"Indianapolis, Indiana, United States",,,"Great Lakes, Midwestern US",,Gravity Ventures is a set of seed-stage angel funds that invests in tech-focused startups.,10,http://twitter.com/GoGravity,https://www.linkedin.com/company/gravity-ventures-llc/about/,,,Active,Gravity Ventures is a member managed seed capital fund investing in early stage technology and tech-enabled businesses.,2008-12-15,day,,,,,,http://www.gravityventures.com,info@gravityventures.com,,,Angel Group,"Early Stage Venture, Seed",11,13,,,3,3,,,,"16,653",1.3,2.7,-0.5,258,189,,1,,1,,100%,,"24,475,573",,,15,,,9,,,,,,,
Kansas Bioscience Authority,https://www.crunchbase.com/organization/kansas-bioscience-authority,"Olathe, Kansas, United States",,,Midwestern US,,"Kansas has the largest concentration of animal health companies in the world. Their researchers are making breakthroughs in oncology, IT,  medical devices, and other important areas of human health. And they're advancing solutions in agribusiness on the strength of their agricultural heritage.",,,http://www.linkedin.com/company/kansas-bioscience-authority,http://www.facebook.com/kansasbioscienceauthority,,Active,"Kansas has the largest concentration of animal health companies in the world. Their researchers are making breakthroughs in oncology,",2004-01-01,year,,,,,,http://www.kansasbioauthority.org,sailors@kansasbioauthority.org,(913) 397-8300,,"Government Office, Incubator",Early Stage Venture,9,13,,4,1,1,,,,"35,963",-0.3,0.9,4.1,,,,,,,,,,,,,7,,,2,,,,,,,
A.G. Edwards Capital Partners,https://www.crunchbase.com/organization/a-g-edwards-capital-partners,"St Louis, Missouri, United States",,,Midwestern US,,,,,,,,Active,"The firm invests in funds that target information technology, telecommunications services, healthcare, consumer staples, manufacturing.",,,,,,,,,,,,Venture Capital,,7,13,,,4,4,,,,"66,678",-0.6,-0.8,1.7,,,,,,,,,,,,,2,,,,,,,,,,
Tamarind Hill,https://www.crunchbase.com/organization/tamarind-hill,"Ann Arbor, Michigan, United States",,,"Great Lakes, Midwestern US",,"Tamarind Hill provides Entrepreneurial Stage Capital™ to SaaS companies in B2B markets: healthcare IT and enterprise IT.  With offices in Ann Arbor and Columbus, we look for opportunities throughout the Midwestern U.S.",,https://twitter.com/tamarind_hill,https://www.linkedin.com/company/tamarind-hill-fund/about/,,,Active,Tamarind Hill provides Entrepreneurial Stage Capital™ to SaaS companies in B2B markets: healthcare IT and enterprise IT.,2016-11-15,day,,,,,,http://www.tamarind-hill.com,info@tamarind-hill.com,(419)345-7688,,Venture Capital,"Early Stage Venture, Seed",10,12,,4,,,,,,"12,590",0.4,0,-0.6,,137.57,-100%,,,,,,,,,,13,,,,,,,,,,
Next Level Ventures,https://www.crunchbase.com/organization/next-level-ventures,"Des Moines, Iowa, United States",,,Midwestern US,,"Next Level Ventures is a venture capital firm investing in growing companies based in Iowa. Next Level Ventures typically invest $1 million to $4 million for a minority ownership position in later-stage venture situations. Their team is looking for Iowa companies that have the potential to become big opportunities. Next Level Ventures provides capital and strong management expertise to help your company grow. Next Level Ventures is a certified Iowa Innovation Fund, contributing to Iowa’s economic development, and proud to be a part of the Iowa business community.",20,http://twitter.com/nextlevelvc,https://www.linkedin.com/company/next-level-ventures,https://www.facebook.com/Nextlevelventures-682279448818897,,Active,"Founded in 2013, Next Level Ventures provides capital and management expertise for growing companies in Iowa.",2013-05-01,day,,,,,,http://nextlevelventures.com/,info@nextlevelvc.com,515.369.2600,,Micro VC,Early Stage Venture,10,12,,7,,,,,,"12,771",-0.1,-0.1,-0.1,,,,,,,,,,,,,6,,,,,,,,,,
Fifth Third Capital,https://www.crunchbase.com/organization/fifth-third-capital,"Cincinnati, Ohio, United States",,,"Great Lakes, Midwestern US",,"Fifth Third provides strategic Capital Markets advice and solutions that make a difference in the future of their clients. Companies today face an increasingly complex set of challenges and opportunities. To effectively operate a business and stay competitive, companies need a strong ally who can navigate the sophisticated landscape and provide analysis, advice, and high-quality execution that will help propel their growth. Their Capital Markets team focuses on strategic relationships, taking the time to fully understand their clients' needs so that they can deliver advice and solutions that will make a significant difference in their business. That means they think beyond the transaction at hand—to consider the future, so they can be a trusted resource for years to come. Leading their team are seasoned, senior bankers who have long-established industry relationships across many sectors. With their expertise and Fifth Third's comprehensive bank services, they can offer truly integrated strategic advice and solutions for your Capital Markets needs.",9,https://twitter.com/fifththird,https://www.linkedin.com/company/fifth-third-bank/,https://www.facebook.com/FifthThirdBank/,,Active,Fifth Third Capital provides strategic Capital Markets advice and solutions.,1858-01-01,year,,,,,,https://www.53.com/commercial-banking/capital-markets/,,800-972-3030,,Corporate Venture Capital,Late Stage Venture,10,12,,7,2,2,,,,"13,063",0,0.2,0.8,,,,,,,,,,,,,16,,,,,,,,,,
Bodley Group,https://www.crunchbase.com/organization/bodley-group,"St Louis, Missouri, United States",,,Midwestern US,,"Bodley Group invests in seed or growth opportunities with compelling teams and a clear potential for outperformance. We seek to invest in companies with new proprietary technology, concept durability, clearly defined customer acquisition strategies, network effects and the potential for rapid growth. Most importantly, we target inspirational founders who are convinced of their plan for a different future and possess the fortitude to make their vision a reality. We have offices in St. Louis, Missouri and Palo Alto, California.",3,https://www.twitter.com/bodleyted,,,,Active,Bodley Group is a venture capital firm that invests in seed- and growth-stage technology companies.,2005-01-01,year,,,,,,http://www.bodleygroup.com,,,,"Family Investment Office, Micro VC",,12,12,,,4,4,,,,"16,547",-0.1,-0.2,-0.1,339,255.4,130.3%,32,-97.28%,5.17,-74.16%,,,"15,488,303","-728,670",-4.49%,11,,,18,,,,,2224514,USD,2224514
Charmides Capital,https://www.crunchbase.com/organization/charmides-capital,"Carmel, Indiana, United States",,,"Great Lakes, Midwestern US",,"Charmides Capital is a venture firm that co-invests with institutional investors in Indiana and the Midwest to fund early stage startups. The firm identifies business to business software as a service companies (B2B SaaS) that we believe demonstrate high growth potential. With a group of partners who possess a diverse set of backgrounds, we bring strategic value to a wide range of companies. Charmides, Plato's uncle, was well known in 5th Century B.C.E. Athens for possessing the virtue of ""sophrosyne"", which has no direct translation in English. Plato immortalized this in a dialogue between Socrates and Charmides that bears the latter's name. The Greek word refers to a well developed consciousness of oneself and one's legitimate duties in relation to others. It involves both a sense of dignity and self-command, along with an awareness of one's strengths and weaknesses. We at Charmides Capital wish to emulate the virtue that Socrates's interlocutor demonstrates in all of our actions.",1,https://twitter.com/charmidescap,https://www.linkedin.com/company-beta/6624956/,,,Active,"Charmides Capital focuses on early stage ventures to provide strategy, operational process, aligned management, and capital to drive growth.",2015-06-01,month,,,,,,http://charmidescapital.com/,teggleston@charmidescapital.com,317.710.5416,,"Micro VC, Venture Capital","Early Stage Venture, Seed",11,12,,,1,1,,,,"20,745",1.2,1.1,0,,89.26,-100%,,,,,,,,,,7,,,7,,,,,,,
3x5 Special Opportunity Fund,https://www.crunchbase.com/organization/3x5-special-opportunity-fund,"St Louis, Missouri, United States",,,Midwestern US,,"3x5 Special Opportunity Fund, L.P. specializes in later-stage companies within the healthcare and clean-tech sectors.",,,,,,Active,"3x5 Special Opportunity Fund, L.P. specializes in later-stage companies within the healthcare and clean-tech sectors.",2011-01-01,year,,,,,,http://3x5fund.com,info@3x5fund.com,(503) 808-9645,,Venture Capital,"Early Stage Venture, Late Stage Venture",7,12,,3,4,4,,,,"21,986",1.2,1.9,2.2,185,30.92,,,,1,,100%,,"27,249,319",,,5,,,,,,,,,,
CHV Capital,https://www.crunchbase.com/organization/chv-capital,"Indianapolis, Indiana, United States",,,"Great Lakes, Midwestern US",,"CHV Capital, Inc. (CHV) is an early-stage investor focused on building value in business opportunities that serve a business or clinical need in the market. They are a return-driven venture capital fund guided by the strategic objectives of Indiana University Health, Indiana’s largest health care system.",,https://www.twitter.com/iu_health,https://www.linkedin.com/company/indiana-university-health,https://www.facebook.com/iuhealth,,Active,"CHV Capital, Inc. (CHV) is an early-stage investor focused on building value in business opportunities that serve a business or clinical",,,,,,,,http://www.chvcapital.com,pr@iuhealth.org,800.248.1199,,Venture Capital,"Early Stage Venture, Late Stage Venture, Seed",9,12,,1,3,3,,,,"22,160",-0.2,-0.3,-0.3,,53.2,,,,,,,,,,,8,,,,,,,,,,
Allied Capital,https://www.crunchbase.com/organization/allied-capital,"Kalamazoo, Michigan, United States",,,"Great Lakes, Midwestern US",,"Allied Capital Corporation, a leading business development company with total assets of more than $4 billion, has paid regular, quarterly cash dividends to shareholders since 1963. Allied Capital invests in the American entrepreneurial economy by providing capital to companies seeking a long-term financial partner and access to managerial resources often unavailable to smaller companies. Since its IPO in 1960, Allied Capital has provided long-term debt and equity financing to thousands of middle market companies. In serving its shareholders, Allied Capital helps build middle market businesses and support American jobs. The Company’s private finance portfolio includes investments in over 100 companies that generate aggregate revenues of more than $12 billion and employ more than 85,000 people. Allied Capital provides flexible, competitive debt and equity capital for management and sponsor-led buyouts, recapitalizations, acquisitions and growth of middle market companies. Allied Capital’s seamless, one-stop financing capabilities include first and second lien senior loans, unitranche debt, junior or mezzanine debt and equity.  Headquartered in Washington, DC, Allied Capital offers shareholders the opportunity to participate in the private equity industry through an investment in the Company’s New York Stock Exchange-listed stock, which is traded under the symbol ALD.",7,,,,,Active,Harry W. Albright nearly defined the tenant-landlord partnership early in his career when he assisted a digital equipment company with its,1963-01-01,year,,,,,,http://www.alliedcapitalcorp.com,info@alliedcapitalcorp.com,239.437.2386,,Private Equity Firm,,11,12,,5,7,7,,,,"29,052",0.2,0.8,3,,,,,,,,,,,,,8,,,,,,,,,,
First Step Fund,https://www.crunchbase.com/organization/first-step-fund,"Detroit, Michigan, United States",,,"Greater Detroit Area, Great Lakes, Midwestern US",,"The First Step Fund provides emerging companies with access to seed capital, focused mentoring in areas consistent with growing the business, and a network that will work to foster demand and create opportunities.",5,,,,,Active,First Step Fund is a seed- and early-stage fund that aims to invest in high-growth emerging companies.,2010-03-01,day,,,,,,https://www.investdetroit.vc/first-capital-fund,,,,Venture Capital,"Early Stage Venture, Seed",10,12,,,2,2,,,,"29,944",0.1,1.4,0,,,,,,,,,,,,,,,,,,,,,,,
Linseed Capital,https://www.crunchbase.com/organization/linseed-capital,"Omaha, Nebraska, United States",,,Midwestern US,,"We founded and manage Linseed Capital to invest in great companies, help people achieve their ambitions and to make money.  We are angel investors living in Omaha, Nebraska and Montecito, California.  We actively mentor and support the entrepreneurial environment in the Midwest.  We invest both independently and as members of The Nebraska Angels investment group.  We sponsor Big Omaha, an annual innovation and entrepreneurship conference and were regional founders of the Pipeline Entrepreneur Fellowship Program.  We serve together on the board of KANEKO, and separately on other nonprofit- and for-profit boards. Jim is Senior Associate to the President of the University of Nebraska and President of the University Technology Development Corporation. He is also Professor of Pathology and Microbiology at University of Nebraska Medical Center (UNMC). He earned his B.S. in Biochemistry and Microbiology from Iowa State University, and his M.D, from UNMC. After residency training at Duke University he returned to UNMC, where he has been on the faculty since 1983. His experience in the private sector includes servings as a corporate officer at Cytyc Corporation, a leading manufacturer of medical devices, from 1995 thru 2007. He now is the a founder and Chief Medical Officer of Constitution Medical Inc., a Warburg Pincus company. Karen is President of Tethon3D and a member of Women Investing in Nebraska (WIN) philanthropic group.  She earned her B.S. degree in Biology from Nebraska Wesleyan University.  In 1995, she founded the School of Cytotechnology at the University of Nebraska Medical Center, and is Past President of the American Society for Cytotechnology.  In 2001, she founded a reference laboratory, Heartland Pathology, Inc. and sold it in 2011.   Her book profiling women business leaders,  “The Women of Berkshire Hathaway”, was published in 2012.",9,http://twitter.com/LinseedCapital,,,,Active,"We founded and manage Linseed Capital to invest in great companies, help people achieve their ambitions and to make money.",2007-01-01,year,,,,,,http://linseedcapital.com,,,,Angel Group,"Early Stage Venture, Private Equity, Seed",8,12,,1,2,2,,,,"31,037",-0.3,-0.4,1.4,25,29.61,,,,1,,100%,,"34,681,979",,,11,,,,,,,,,,
Bayview Capital,https://www.crunchbase.com/organization/bayview-capital,"Wayzata, Minnesota, United States",,,"Greater Minneapolis-Saint Paul Area, Great Lakes, Midwestern US",,"Established in Wayzata, Minnesota in 1995, Bayview Capital Group exclusively represents smaller middle market businesses for sale. Their clients typically have sales between $10 million and $150 million.",,,,,,Active,"Established in Wayzata, Minnesota in 1995, Bayview Capital Group exclusively represents smaller middle market businesses for sale.",1995-01-01,year,,,,,,http://www.bayviewcap.com,tpurdy@bayviewcap.com,(612) 726-5555,,"Micro VC, Venture Capital",Seed,11,12,,,7,7,,,,"33,317",-0.5,-0.4,-0.2,155,178.63,-32.62%,105,-57.03%,2,-40%,0%,-66.67%,"25,754,850","4,073,224",18.79%,6,,,,,,,,2135755,USD,2135755
DaneVest Capital,https://www.crunchbase.com/organization/danevest-capital,"Middleton, Wisconsin, United States",,,"Great Lakes, Midwestern US",,"Located in Dane County, Wisconsin at the center of science, education, government, technology, business and commerce, DaneVest Capital is in tune with current investment opportunities. Working with a variety of industries that are looking for capital solutions, they provide an efficient structure, through a variety of private equity funds, for investors to participate in the growth of local businesses and communities.",3,,,,,Active,"Located in Dane County, Wisconsin at the center of science, education, government, technology, business and commerce, DaneVest Capital is",,,,,,,,http://www.danevestcapital.com,dvc@danevestcapital.com,608-826-4000,,Venture Capital,"Early Stage Venture, Seed",9,12,,2,,,,,,"44,906",-0.6,-0.3,-0.6,283,60.31,,5,,2.35,,,,"19,936,986",,,4,,,,,,,,,,
Chippewa Valley Angel Investors Network,https://www.crunchbase.com/organization/chippewa-valley-angel-investors-network,"Eau Claire, Wisconsin, United States",,,"Great Lakes, Midwestern US",,"The Chippewa Valley Angel Investors Network, LLC was organized in 2003 to meet a need identified in the region by providing private equity financing potential for early stage and start-up entrepreneurial ventures in the greater Chippewa Valley. Supported by Momentum West, the network is owned and operated by its member angel investors. It meets monthly to view presentations from businesses that have been pre-screened and invited to present. By the end of 2009 the CVAIN membership has invested over $3 million in seven early stage companies in the Chippewa Valley and surrounding region, including the Twin Cities and Madison.",4,https://www.twitter.com/momentumwestwi,https://www.linkedin.com/company/3209496,https://www.facebook.com/momentumwestregionaleconomicdev,,Active,"The Chippewa Valley Angel Investors Network, LLC was organized in 2003 to meet a need identified in the region by providing private equity",,,,,,,,http://www.momentumwest.org/index.cfm?event=ViewPage&contentPieceID=1781,info@momentumwest.org,715.874.4673,,Venture Capital,,7,12,,6,,,,,,"48,407",0.7,0.7,-0.2,,,,,,,,,,,,,17,,,,,,,,,,
