Broadhorn Capital,https://www.crunchbase.com/organization/broadhorn-capital,"West Des Moines, Iowa, United States",,,Midwestern US,,"Broadhorn Capital is a venture development firm specializing in early and seed stage technology companies. A strategy is a long term plan of action designed to achieve a particular goal. At Broadhorn Capital, our goal is to develop investments that provide long term, healthy value and returns for stakeholders. We believe that lasting value creation depends on solving relevant problems by bravely executing with unflinching integrity. Specializing in technology startups, we provide services that accelerate your venture through the launch stage into high growth. Twenty years of venture development has bought Broadhorn Capital the experience of tested best practice systems. Your company can benefit from the successes and failures we have had through proven methods. Services include venture development such as plan advisment, board and management development, technology strategy and architecture, proof of concept, sales and marketing development, and private placement services.",3,,,,,Active,Broadhorn Capital is a venture development firm specializing in early and seed stage technology companies.,,,,,,,,http://www.broadhorn.com,,,,Venture Capital,"Early Stage Venture, Seed",1,2,,,,,,,,"51,430",-0.4,-0.4,-0.8,,,,,,,,,,,,,20,,,,,,,,,,
Chatham Venture Partners,https://www.crunchbase.com/organization/chatham-venture-partners,"Indianapolis, Indiana, United States",,,"Great Lakes, Midwestern US",,,,,,,,Active,Chatham Venture Partners is an investment firm specilaizing in capitalization of early stage start ups.,,,,,,,,http://www.chathamvp.com,info@chathamvp.com,,,Private Equity Firm,,2,2,,,,,,,,"51,555",1.6,0.3,2.3,151,80.59,,"1,230",,8,,,,"20,051,050",,,19,,,,,,,,,,
Revolution Capital Partners,https://www.crunchbase.com/organization/revolution-capital-partners,"Omaha, Nebraska, United States",,,Midwestern US,,,,,,,,Closed,Revolution Capital Partners is a boutique private equity firm offering value-added experience and capital to businesses.,2006-01-01,year,,,,none,,http://www.revolutioncap.com,info@RevolutionCap.com,,,Private Equity Firm,Seed,2,2,,,,,,,,"51,615",0.8,-0.2,-0.4,,,,,,,,,,,,,1,,,,,,,,,,
Northland Angel Investor Network,https://www.crunchbase.com/organization/northland-angel-investor-network,"Kansas City, Missouri, United States",,,Midwestern US,,,,,,,,Active,The Northland Angel Investors Network connects investors with business opportunities.,2016-03-31,day,,,,,,http://northlandinvestors.com/,angel@clayedc.com,816.468.4989,,Angel Group,,1,2,,,,,,,,"51,719",1.6,3.9,1.3,823,137.24,,"1,016",,3.55,,14.75%,,"13,417,994",,,17,,,,,,,,,,
Keystone Capital,https://www.crunchbase.com/organization/keystone-capital,"Columbus, Ohio, United States",,,"Great Lakes, Midwestern US",,"Keystone Capital partners with exceptional teams with real technology looking to build transformative yet capital efficient businesses. The domain of interest includes Consumer eCommerce, Healthcare, Artificial Intelligence & Machine Learning, Robotics, and other technology areas.",,,,,,Active,Keystone Capital is a seed stage venture capital firm that provides funding and support to US startups.,2014-01-01,year,,,,,,,,,,Venture Capital,"Early Stage Venture, Seed",2,2,,,,,,,,"52,934",-0.1,1.7,0,,,,,,,,,,,,,,,,,,,,,,,
Akron Archangels,https://www.crunchbase.com/organization/archangels,"Akron, Ohio, United States",,,"Great Lakes, Midwestern US",,,,https://twitter.com/akronarchangels,,,,Active,Akron ArchAngels is a startup city guide website devoted solely to what's going on around Akron OH.,2005-01-01,year,,,,,,https://www.akronarchangels.com/,akronarchangels@gmail.com,,,Angel Group,,2,2,,,,,,,,"52,952",-0.5,-0.1,2.2,604,"1,326.87",-22.98%,9,,1.27,27.41%,83.78%,-16.22%,"16,350,047","1,375,988",9.19%,6,,,,,,,,,,
RES Investments,https://www.crunchbase.com/organization/res-investments,"Saint Paul, Minnesota, United States",,,"Greater Minneapolis-Saint Paul Area, Great Lakes, Midwestern US",,,,,,,,Active,Strategic investment arm,,,,,,,,,,,,Venture Capital,"Early Stage Venture, Late Stage Venture",2,2,,,1,1,,,,"53,768",-0.6,-0.5,-0.7,,,,,,,,,,,,,,,,,,,,,,,
Validus Partners,https://www.crunchbase.com/organization/validus-partners,"Minnetonka, Minnesota, United States",,,"Greater Minneapolis-Saint Paul Area, Great Lakes, Midwestern US",,,,,,,,Active,Validus has been investing with internationally leading investment firms since 1997.,,,,,,,,http://www.validusvc.com,,,,Private Equity Firm,,2,2,,1,1,1,,,,"55,377",-0.5,-0.5,-0.1,,,,,,,,,,,,,6,,,,,,,,,,
Razorback Capital,https://www.crunchbase.com/organization/razorback-capital,"Kansas City, Missouri, United States",,,Midwestern US,,,1,,,,,Active,Razorback Capital is a Kansas City-based venture capital firm focused on early stage investments.,1999-01-01,year,,,,,,http://www.razorbackcapital.com,info@razorbackcapital.com,913-362-1114,,"Micro VC, Venture Capital","Early Stage Venture, Seed",2,2,,,,,,,,"56,096",0,1,-0.2,,,,,,,,,,,,,9,,,,,,,,,,
XR Ventures,https://www.crunchbase.com/organization/xr-ventures,"Grandville, Michigan, United States",,,"Great Lakes, Midwestern US",,XR Ventures is a venture capital firm.,,,,,,Closed,XR Ventures is a venture capital firm.,,,,,,none,,,,,,Venture Capital,"Early Stage Venture, Seed",2,2,,1,1,1,,,,"56,219",-0.1,0.9,0.2,,,,,,,,,,,,,,,,,,,,,,,
Midwest Oilseeds,https://www.crunchbase.com/organization/midwest-oilseeds,"Ames, Iowa, United States",,,Midwestern US,,"Midwest Oilseeds Inc is a private company categorized under Agricultural research and located in Ames, IA.",,,,,,Active,venture company,,,,,,,,,,,,Venture Capital,Late Stage Venture,1,2,,,1,1,,,,"56,779",0.2,1.4,2.8,,,,,,,,,,,,,,,,,,,,,,,
Lis Ventures,https://www.crunchbase.com/organization/lis-ventures,"Farmington Hills, Michigan, United States",,,"Greater Detroit Area, Great Lakes, Midwestern US",,"Lis Ventures LLC We invest in ideas and concepts which improves the wellness, vitality and lifestyle of people. We look for smart ideas which we dim practical, useful and likely to succeed. We like to invest in companies where we can add value beyond our investment.",,,,,,Active,"Lis Ventures invests in ideas and concepts that improve the wellness, vitality and lifestyle of people.",,,,,,,,http://www.lisventures.com,,,,"Micro VC, Venture Capital",Early Stage Venture,2,2,,,1,1,,,,"56,822",-0.4,-0.3,-0.5,,,,,,,,,,,,,10,,,,,,,,,,
Mariner Capital Ventures,https://www.crunchbase.com/organization/mariner-capital-ventures,"St Louis, Missouri, United States",,,Midwestern US,,"Mariner Capital Ventures (MCV) is a $10 million start-up, angel, and early stage investment fund. MCV targets new and young companies that design innovative and competitive products and services. They support creative entrepreneurs with strategies to accelerate growth, optimize performance, and create value.",,,,,,Closed,"Mariner Capital Ventures (MCV) is a $10 million start-up, angel, and early stage investment fund.",,,,,,none,,http://www.marinerprivateequity.com,,,,Micro VC,Late Stage Venture,2,2,,1,2,2,,,,"57,566",-0.2,0.4,0.1,,,,,,,,,,,,,3,,,,,,,,,,
Goel Fund,https://www.crunchbase.com/organization/goel-fund,"Williston, North Dakota, United States",,,Midwestern US,,,,,,,,Active,Goel Fund is a known investing company with generation of innovaters.,,,,,,,,http://www.goelfund.com,,,,Private Equity Firm,,2,2,,,,,,,,"58,656",0.6,2.8,-0.1,,28.53,-100%,,,,,,,,,,9,,,,,,,,,,
Andcor Companies,https://www.crunchbase.com/organization/andcor-companies,"Wayzata, Minnesota, United States",,,"Greater Minneapolis-Saint Paul Area, Great Lakes, Midwestern US",,"Established in 1969, Andcor Companies Inc. is the Upper Midwest's leading recruiter of entrepreneurial leaders for high growth companies. Andcor has accelerated the growth of hundreds of visionary early and expansion stage companies in virtually every industry though customized professional and executive level search solutions tailored to their clients specific requirements and stage of growth.",,http://twitter.com/Andcor,,https://www.facebook.com/andcor-companies-inc-310932484881,,Active,Customized recruitment solutions for visionary MN based companies with an equity for services + direct investment business model,1969-01-01,year,,,,,,http://www.andcor.com,info@andcor.com,+1 952-404-8060,,Angel Group,,2,2,,,,,,,,"61,887",-0.3,-0.5,-0.3,413,594.69,,123,,2.28,,74.49%,,"17,024,812",,,31,,,13,,,,,38509,USD,38509
Iowa Corn Opportunities,https://www.crunchbase.com/organization/iowa-corn-opportunities,"Johnston, Iowa, United States",,,Midwestern US,,"Iowa Corn Opportunities, LLC (ICO) is an equity fund established by the Iowa Corn Growers Association (ICGA) to: Make profitable, strategic, value-added investments that will benefit Iowa’s corn grower members. Facilitate new business development opportunities for Iowa’s corn growers. Leverage investments to facilitate and coordinate further investment by individual corn growers. Iowa Corn Opportunities is a limited liability company solely owned by the ICGA, and directed by an eight-member board of managers.",3,,,,,Active,Iowa Corn Opportunities is an equity fund established by the Iowa Corn Growers Association.,,,,,,,,http://www.iowacornopportunities.com/,,(515) 225-0781,,Fund Of Funds,,2,2,,,,,,,,"65,197",-0.4,-0.6,-1.2,,,,,,,,,,,,,5,,,,,,,,,,
WT Investment Advisors Fund,https://www.crunchbase.com/organization/wt-investment-advisors-fund,"Oshkosh, Wisconsin, United States",,,"Great Lakes, Midwestern US",,,,,,,,Active,WT Investment Advisors Fund is a privately held American biotechnology companies.,,,,,,,,,,,,Private Equity Firm,Private Equity,1,2,,,1,1,,,,"66,604",-0.2,1.2,2.2,,,,,,,,,,,,,,,,,,,,,,,
MRM Capital,https://www.crunchbase.com/organization/mrm-capital,"Cincinnati, Ohio, United States",,,"Great Lakes, Midwestern US",,,,,https://www.linkedin.com/company/mrm-capital/,,,Active,"MRM Capital is a money management firm that identifies, measures, monitors and manages market risk. ",,,,,,,,http://www.mrmcapital.com,,,,Venture Capital,Early Stage Venture,1,2,,,,,,,,"67,138",-0.4,-0.2,-0.8,,,,,,,,,,,,,4,,,,,,,,,,
Solomon Global Holdings,https://www.crunchbase.com/organization/solomon-global-holdings,"Columbus, Ohio, United States",,,"Great Lakes, Midwestern US",,,,http://twitter.com/SGHColumbus,http://www.linkedin.com/company/solomon-global-holdings-inc.,http://www.facebook.com/SolomonGlobalHoldings,,Active,Solomon Global Holdings is a venture capital firm.,,,,,,,,http://www.solomonglobalholdings.com,info@solomongh.com,,,Private Equity Firm,,2,2,,,1,1,,,,"68,706",-0.6,-1,-0.7,,,,,,,,,,,,,,,,,,,,,,,
Queen City Angels First Funds,https://www.crunchbase.com/organization/queen-city-angels-first-funds,"Cincinnati, Ohio, United States",,,"Great Lakes, Midwestern US",,"The QCA First Funds are a family of small investment funds which were established in 2003 to help fledgling companies reach important milestones in their development and attract additional investment from conventional sources.  They have been created by matching investments from the State of Ohio's Third Frontier Action Fund.  Members of the Queen City Angels, with support from the Tri-State Growth Capital Fund and others, provide management and oversight of the Fund, as well as mentoring and guidance to the portfolio companies. In 2006, a second Fund was established to continue the work.  QCA First Fund II received support from the same sources as the original Fund, and has completed its investment activities. In 2009, QCA First Fund III was created.  This Fund is somewhat larger, and has received matching investment from the Ohio Capital Fund in addition to the others mentioned above. In late 2013, we began making investments from our our largest fund to date.  QCA First Fund IV will continue the work of the previous Funds to help start-up companies meet their initial growth objectives and attract additional investment.",,,,,,Active,The QCA First Funds are a family of small investment funds which were established in 2003 to help fledgling companies reach important,2003-01-01,year,,,,,,http://www.qcafirstfund.com,webmaster@qcafirstfund.com,,,Angel Group,Early Stage Venture,2,2,,,,,,,,"68,763",-0.2,1.4,3.3,,,,,,,,,,,,,3,,,,,,,,,,
Iowa Capital Management,https://www.crunchbase.com/organization/iowa-capital-group,"Fairfield, Iowa, United States",,,Midwestern US,,"owa Capital Management, Inc., is a federally licensed Commodities firm, specializing in Professionally Managed Futures Investments. They find money managers with exceptional performance records in commodity futures trading. Iowa Capital Management, Inc. is a registered Introducing Brokerage with the Commodity Futures Trading Commission, is a member of the National Futures Association and the National Introducing Brokers Association.",,,,,,Closed,Futures Investments,,,,,,none,,http://www.iowacapital.com,yourmoney@iowacapital.com,,,Private Equity Firm,Late Stage Venture,1,2,,,1,1,,,,"71,474",0.5,1.9,3.6,,,,,,,,,,,,,,,,,,,,,,,
InvestAmerican Investment Advisors,https://www.crunchbase.com/organization/investamerican-investment-advisors,"Minneapolis, Minnesota, United States",,,"Greater Minneapolis-Saint Paul Area, Great Lakes, Midwestern US",,"InvestAmerica is a nationally recognized private equity/venture capital investment management group with over 100 cumulative years of fund management experience. The Principals founded the InvestAmerica brand in 1985 with the establishment of InvestAmerica Venture Group, Inc. Since 1985, the Principals have successfully managed and grown the InvestAmerica related private equity/venture funds with investments throughout the United States.",,,,,,Active,InvestAmerica is a nationally recognized private equity/venture capital investment management group with over 100 cumulative years of fund,1985-01-01,year,,,,,,http://www.investamericaventure.com,,319-363-8249,,Private Equity Firm,"Debt, Early Stage Venture",2,2,,,1,1,,,,"75,513",-0.2,-0.6,-0.5,,,,,,,,,,,,,5,,,,,,,,,,
Becker Ventures,https://www.crunchbase.com/organization/becker-ventures,"Grosse Pointe Park, Michigan, United States",,,"Greater Detroit Area, Great Lakes, Midwestern US",,,,,,,,Active,Becker Ventures is a company that specialize in investment services.,,,,,,,,,,,,Venture Capital,,2,2,,1,,,,,,"75,866",-0.4,-0.5,-1.1,,,,,,,,,,,,,,,,,,,,,,,
Motor City Investments,https://www.crunchbase.com/organization/motor-city-investments,"Detroit, Michigan, United States",,,"Greater Detroit Area, Great Lakes, Midwestern US",,,,,,,,Closed,"Motor City Investments is a boutique firm based in Detroit, Michigan focused on early entry seed rounds.",,,,,,none,,http://motorcinvestments.com/,,,,Venture Capital,,2,2,,,,,,,,"76,106",-0.4,-0.2,-0.2,,,,,,,,,,,,,,,,,,,,,,,
Swan's Egg,https://www.crunchbase.com/organization/swan-s-egg,"St Louis, Missouri, United States",,,Midwestern US,,,,,,,,Active,"Venture Captial firm out of St. Louis, MO",2018-01-02,day,,,,,,,,,,Angel Group,Early Stage Venture,2,2,,2,,,,,,"76,662",0.2,1.7,-0.7,,,,,,,,,,,,,,,,,,,,,,,
Galera Angels,https://www.crunchbase.com/organization/galera-angels,"St Louis, Missouri, United States",,,Midwestern US,,,,,,,,Active,Galera Angels is an investment company focused on companies in the biotechnology sector.,,,,,,,,,,,,Venture Capital,Early Stage Venture,1,2,,,,,,,,"79,404",-0.1,0.4,-0.3,,,,,,,,,,,,,,,,,,,,,,,
Capital for Business,https://www.crunchbase.com/organization/capital-for-business,"St Louis, Missouri, United States",,,Midwestern US,,"At CFB® they understand that growing an exceptional business is a lengthy, complex process with many unexpected twists and potential pitfalls. Accordingly, they are a patient investor, investing with a typical time horizon of between five and seven years depending on the particular circumstances. They also invest with the mindset that growth requires additional capital and within their funds they maintain adequate reserves to meet any follow-on investment needs. They maintain an extensive network of contacts in the financial markets and in particular the private equity community, and can assist their portfolio companies by bringing additional experts, advisors, or investors into a transaction.",,,https://www.linkedin.com/company/capital-for-business-inc.,https://www.facebook.com/capitalforbusiness,,Active,Capital for Business is a private investment firm.,,,,,,,For Profit,http://www.capitalforbusiness.com/#no_splash,info@capitalforbusiness.com,(314)746-7427,,Private Equity Firm,Private Equity,2,2,,2,,,,,,"79,967",1.1,0.9,-0.2,,,,,,,,,,,,,3,,,2,,,,,,,
Lorain County Community College Innovation Fund,https://www.crunchbase.com/organization/lorain-county-community-college-innovation-fund,"Elyria, Ohio, United States",,,"Great Lakes, Midwestern US",,"The Innovation Fund, founded by the Lorain County Community College Foundation (2007), is a regional fund focused on supporting",,https://www.twitter.com/customerboom,https://www.linkedin.com/in/chrismather9,https://www.facebook.com/customerboom.social,,Active,"The Innovation Fund, founded by the Lorain County Community College Foundation (2007), is a regional fund focused on supporting",2007-01-01,year,,,,,,http://www.innovationfundneohio.com,info@innovationfundneohio.com,(440) 366-4121,,"Private Equity Firm, University Program, Venture Capital",Seed,2,2,,,,,,,,"84,652",-0.4,-0.3,-0.1,,,,,,,,,,,,,5,,,,,,,,,,
Harrington Family,https://www.crunchbase.com/organization/harrington-family,"Hudson, Ohio, United States",,,"Great Lakes, Midwestern US",,,,,,,,Active,"Harrington Family is an investment firm based in Hudson, Ohio.",,,,,,,,,,,,Family Investment Office,,1,2,,1,,,,,,"89,701",-0.3,-0.3,-0.5,,,,,,,,,,,,,,,,,,,,,,,
TD Ameritrade,https://www.crunchbase.com/organization/td-ameritrade,"Omaha, Nebraska, United States",,,Midwestern US,,"TD AMERITRADE Holding Corporation, through its subsidiaries, provides securities brokerage services and technology-based financial services in the United States. The company provides common and preferred stocks, exchange-traded funds, option trades, mutual funds, fixed income, margin lending, and cash management services.","1,027",http://twitter.com/tdameritrade,http://www.linkedin.com/company/td-ameritrade,http://www.facebook.com/tdameritrade,,Active,TD Ameritrade is a finance company in online stock trading.,1975-01-01,year,1997-03-04,day,,,For Profit,http://www.tdameritrade.com,,402-331-7856,,Venture Capital,Early Stage Venture,1,1,,,,,,,,"2,219",-0.9,-1.2,-0.7,"13,124,041","13,408,029.96",5%,189,4.35%,3.25,3.22%,58.66%,-0.4%,"5,035",-152,-2.93%,104,9,"144,055",84,0,15,,Insurance; financial affairs,79707,USD,79707
University of Nebraska Medical Center,https://www.crunchbase.com/organization/university-of-nebraska-medical-center,"Omaha, Nebraska, United States",,,Midwestern US,,"In addition to providing training for today’s leading medical and healthcare fields, University of Nebraska Medical Center (UNMC) is at the forefront of major research activities. Located in Omaha, Nebraska, UNMC is particularly well known and respected for its programs in Nursing, Pharmacy, Physical Therapy and Physician Assisting. UNMC also has a medical and dental school that trains future doctors and dentists. In addition to offering high-quality medical education, UNMC conducts hundreds of research projects yearly at its Durham Research Centers. Research activities include discoveries and contributions in such areas as cancer treatments and transplant medicine. Since the student population remains relatively small, both classes and research activities take place in small groups, giving students the chance to work with faculty members, who are leaders and pioneers in their field. Additional healthcare education programs include training for such fields as Clinical Laboratory Science, Cytotechnology, Medical Sonography and Radiation Therapy. Each program has its own admission requirements. Students may also apply for funding through research assistantships and fellowships.",103,http://twitter.com/unmc,https://www.linkedin.com/company/university-of-nebraska-medical-center,http://www.facebook.com/60586020276,,Active,University of Nebraska - Medical Center is a school in Omaha.,1869-09-10,day,,,,,,http://www.unmc.edu/,info@nufnd.uneb.edu,(888) 805-1115,,University Program,,1,1,,,,,,,,"3,148",-0.9,-1.2,-0.5,"546,573","557,783.72",7.02%,167,8.35%,3.67,9.35%,54.33%,-1.24%,"102,704","-4,274",-4%,95,4,,19,,,,,106936328,USD,106936328
NDI Medical,https://www.crunchbase.com/organization/ndi-medical,"Cleveland, Ohio, United States",,,"Great Lakes, Midwestern US",,"NDI Medical, founded in 2002, is a medical device incubator. They develop high-growth companies that focus on innovative neurostimulation technologies to address significant unmet health conditions. Their team includes seasoned entrepreneurs, scientists, physician advisors, and professionals in clinical and regulatory affairs, product development, quality, and finance.",4,,,,,Active,NDI Medical is a medical device incubator developing high-growth companies that focus on innovative neurostimulation technologies.,2002-01-01,year,2008-04-15,day,,,For Profit,http://www.ndimedical.com,info@ndimedical.com,(216)378-9106,,Venture Capital,Early Stage Venture,1,1,,,,,,,,"3,483",-0.1,2.2,1.1,48,132.74,,,,1,,100%,,"33,277,420",,,6,,,9,2,6,Medical Or Veterinary Science; Hygiene,Medical apparatus and instruments,323425,USD,323425
Anoloriya,https://www.crunchbase.com/organization/anoloriya,"Ann Arbor, Michigan, United States",,,"Great Lakes, Midwestern US",,,,,,,,Active,"imaginative insight, sustainable strategy, & efficient execution.",2017-01-01,year,,,,,For Profit,https://anoloriya.com,hi@anoloriya.com,,,Micro VC,Early Stage Venture,1,1,,,,,,,,"4,981",1.1,-0.1,-0.7,,24.06,-100%,,,,,,,,,,9,,,,,,,,,,
SparkLabKC,https://www.crunchbase.com/organization/sparklabkc,"Kansas City, Missouri, United States",,,Midwestern US,,"SparkLabKC  Our mission is to support early-stage technology business startups using a proven seed-stage, mentorship-driven accelerator program that is adapted to the Kansas City region. Our program builds on public-private partnerships and the strengths of the region’s vast entrepreneurial community.",3,http://twitter.com/SparkLabKC,,http://www.facebook.com/Sparklabkc,,Active,"SparkLabKC Our mission is to support early-stage technology business startups using a proven seed-stage, mentorship-driven accelerator",2012-01-01,year,,,,,,http://sparklabkc.com,info@sparklabkc.com,,,Accelerator,,1,1,,,,,,,,"5,085",-0.2,0.3,5.3,,,,,,,,,,,,,3,,,,,,,,,,
Nature's Way,https://www.crunchbase.com/organization/nature-s-way,"Green Bay, Wisconsin, United States",,,"Great Lakes, Midwestern US",,"Nature’s Way is the most recognized and trusted manufacturers of dietary supplements and vitamins. A pioneer in herbal supplements, the Nature’s Way brand is known for its expansive offerings of whole herbs, standardized extracts, vitamins & minerals, and homeopathic remedies. Beyond herbal supplements, Nature’s Way manufactures trusted brands such as Alive! multi-vitamins, Fortify probiotics, Umcka® Cold Care, and Sambucus. Their brands are sold through retail partners in the grocery, drug, mass, health food store, eCommerce and other channels, and they are proud to be growing rapidly.",,https://twitter.com/natureswaybrand,https://www.linkedin.com/company/schwabe_north_america/,https://www.facebook.com/NaturesWayBrands/,,Active,Nature’s Way is the most recognized and trusted manufacturers of dietary supplements and vitamins.,,,,,,,,https://www.naturesway.com/,,1-800-962-8873,,Venture Capital,"Early Stage Venture, Seed",1,1,,1,,,,,,"7,391",-0.2,9.2,9.2,,,,,,,,,,,,,,,,19,,,,,,,
Indiana University Foundation,https://www.crunchbase.com/organization/indiana-university-foundation,"Indianapolis, Indiana, United States",,,"Great Lakes, Midwestern US",,,,https://www.twitter.com/iufoundation,https://www.linkedin.com/company/indiana-university-foundation,https://www.facebook.com/iufoundation,,Active,Indiana University Foundation is a fundraising organization that supports Indiana University.,1936-01-01,year,,,,,,https://iufoundation.iu.edu,iuf@indiana.edu,800-558-8311,,University Program,,1,1,,,,,,,,"7,494",0.6,-0.1,-0.2,"5,764","4,742.53",59.09%,28,-35.79%,1.5,-5.8%,47.72%,-15.57%,,,,16,,,,,,,,,,
Grange Insurance,https://www.crunchbase.com/organization/grange-insurance,"Columbus, Ohio, United States",,,"Great Lakes, Midwestern US",,"Grange Insurance was first formed 80 years ago to provide affordable car insurance for a specific group—grange members (known nationally as the National Grange Patrons of the Husbandry). But even in the company’s earliest days, its leaders were thinking ahead to the future.",6,https://twitter.com/GrangeInsurance,https://www.linkedin.com/company/164038,https://www.facebook.com/grangeinsurancemarketing,,Active,"Grange Insurance provides tips and articles for our policyholders & agents to help you stay informed about home, business & life insurance.",1935-01-01,year,,,,,For Profit,https://www.grangeinsurance.com/,,(800) 422-0550,,Venture Capital,,1,1,,1,,,,,,"7,602",4.3,3.7,5.8,"138,807","158,234.11",-24.37%,239,-2.36%,5.65,-8.65%,28.7%,6.19%,"268,479","57,483",27.24%,50,,,17,,,,,,,
